{
  "schema_version": "1.0",
  "transitions": {
    "None": 0,
    "Fade 250 >> 250": 1408872282,
    "Fade 500 >> 500": 2130373248,
    "Fade 1000 >> 1000": 1122508889,
    "Fade 1500 >> 1500": 509674679,
    "Fade 2000 >> 2000": 2482233134,
    "Fade 2500 >> 2500": 1606908815,
    "Fade 3000 >> 3000": 2752031158,
    "Fade 4000 >> 4000": 1238175709,
    "Fade 5000 >> 5000": 3411222921,
    "Fade >> 4000": 259497043,
    "Fade 4000 >>": 1272583944,
    "Fade >> 3000": 3222392982,
    "Fade 3000 >>": 3174465279,
    "Fade >> 2000": 2457385855,
    "Fade 2000 >>": 2243764445,
    "Fade >> 1500": 2127590351,
    "Fade 1500 >>": 4203358158,
    "Fade >> 1000": 2136104277,
    "Fade 1000 >>": 348351892,
    "Fade >> 500": 1974926776,
    "Fade 500 >>": 2046503352,
    "Fade >> 250": 326824049,
    "Fade 250 >>": 2089682509,
    "Fade White 250 >> 250": 3868567233,
    "Fade White 500 >> 500": 2246884625,
    "Fade White 1000 >> 1000": 3182852162,
    "Fade White 1500 >> 1500": 1289388507,
    "Fade White 2000 >> 2000": 3785883235,
    "Fade White 2500 >> 2500": 3181383424,
    "Fade White 3000 >> 3000": 1346493585,
    "Fade White 4000 >> 4000": 4075662009,
    "Fade White 5000 >> 5000": 3539052749,
    "Fade White >> 4000": 3765959531,
    "Fade White 4000 >>": 429693191,
    "Fade White >> 3000": 2259711251,
    "Fade White 3000 >>": 3657480713,
    "Fade White >> 2000": 2527144513,
    "Fade White 2000 >>": 704731093,
    "Fade White >> 1500": 457377075,
    "Fade White 1500 >>": 2160391595,
    "Fade White >> 1000": 1626584722,
    "Fade White 1000 >>": 2878370298,
    "Fade White >> 500": 3977094957,
    "Fade White 500 >>": 42187309,
    "Crossfade 200 >>": 375948222,
    "Crossfade 300 >>": 4187997050,
    "Crossfade 500 >>": 3854440696,
    "Crossfade 1000 >>": 4004024664,
    "Crossfade 1500 >>": 1173843909,
    "Crossfade 2000 >>": 1369285246,
    "Crossfade 2500 >>": 3054018111,
    "Crossfade 3000 >>": 1027503790,
    "Crossfade 3500 >>": 3196842123,
    "Crossfade 4000 >>": 2091508330,
    "Swipe R": 1127535352,
    "Swipe L": 3957412172,
    "Swipe D": 3029168926,
    "Swipe U": 4152299906,
    "Noise": 3344317924,
    "Circle": 1914875660
  },
  "bg_effects": {
    "None": 0,
    "BG_Dust_L": 1377724294,
    "BG_FocusLine": 3550865647,
    "BG_Mist_L": 2728481130,
    "BG_UnderFire": 3134544579,
    "BG_UnderFire_R": 2313116516,
    "BG_Filter_Red": 4006301275,
    "BG_Filter_Red_BG": 2174743540,
    "BG_Ash_Black": 3934311147,
    "BG_Ash_Red": 736631543,
    "BG_Shining_L": 1061522909,
    "BG_Shining_L_BGOff": 1870781268,
    "BG_Love_L": 1679852157,
    "BG_Love_L_BGOff": 3023046476,
    "BG_Flash": 786952175,
    "BG_Flash_Sound": 1566732214,
    "BG_Teleport": 880081110,
    "BG_Rain_L": 3676184657,
    "BG_Snow_L": 2675527592,
    "BG_SandStorm_L": 575794762,
    "BG_Wave_F": 866423043,
    "BG_WaveShort_F": 3610115052,
    "BG_ScrollL_1.0": 176581582,
    "BG_ScrollR_1.0": 442565896,
    "BG_ScrollB_0.5": 1488006201,
    "BG_Fireworks_L_BGOff_01": 2551519896,
    "BG_Fireworks_L_BGOff_02": 2499688462
  },
  "emoticons": {
    "[\ube60\uc9c1]": 0,
    "[\uc7ac\uc798]": 1,
    "\u2026": 2,
    "[!]": 3,
    "[\ud558\ud2b8]": 4,
    "[\uc74c\ud45c]": 5,
    "[?]": 6,
    "[\ubc18\uc751]": 7,
    "[///]": 8,
    "[?!]": 9,
    "[\ub540]": 10,
    "[\ubc18\uc9dd]": 11,
    "[\uc18d\uc0c1\ud568]": 12,
    "[\ub534\uc0dd\uac01]": 13,
    "{Bulb}": 14,
    "{Sad}": 15,
    "{Sigh}": 16,
    "{Steam}": 17,
    "{Tear}": 18,
    "{Zzz}": 19
  },
  "actions": {
    "none": 0,
    "greeting": 1,
    "falldownl": 2,
    "falldownr": 3,
    "stiff": 4,
    "shake": 5,
    "jump": 6,
    "hophop": 7
  },
  "appears": {
    "none": 0,
    "al": 1,
    "ar": 2,
    "a": 3,
    "dl": 4,
    "dr": 5,
    "d": 6
  },
  "shapes": {
    "none": 0,
    "communication": 1,
    "silhouette": 2,
    "communication+silhouette": 3,
    "closeup": 4,
    "communication+closeup": 5,
    "silhouette+closeup": 6,
    "communication+silhouette+closeup": 7
  },
  "hashes": {
    "background": "xxHash32:utf8:seed0"
  }
}
